{"abi":{"abiVersion":1,"callingConvention":"C","capabilityBits":7,"endianness":"Little","entrySymbol":"lumio_core_get_api_v1","pointerWidth":64,"symbolPrefix":"lumio_"},"baselineId":"LGE-V1.4-2026-08-27","bundleId":"root-abi-v1","compiler":{"digest":"4d19b060b8e031b0ccc59a040d126a0c355cf65412307ec00c141d3f0a612f68","name":"lumio-abi-compiler","version":"1.0.0"},"inputHash":"696a58d0525b897b549dd1e432166ae1020835902a5984221a8e60d5d8285bb3","inputSet":["schemas/native-managed-abi.schema.json","fixtures/valid/native-managed-abi.json"],"layoutProfile":{"abiRuntime":"glibc","arch":"x86_64","maxAlignment":8,"os":"LinuxServer","pointerBytes":8,"rootHeaderBytes":16,"tableHeaderBytes":16,"targetProfileId":"linux-x86_64-glibc"},"outputFiles":[{"digest":"fa2aaca231b80ac5118dc13d3f4a4a50a1c16c844f09f8e2ac8d723af11c4352","path":"abi/lumio_core.h","role":"CHeader"},{"digest":"ddf60c5d18398bec0e7dfd42275fbc5c085a24431e495f7f71a03ded00bdcd20","path":"rust/lumio-gen-language-binding/src/root_abi.rs","role":"RustBinding"},{"digest":"08c80b5c7d9001dc6e6c4cce176a5bc26026277a937dc8e8614ead7706ca2110","path":"csharp/Lumio.Gen.LanguageBinding/RootAbi.cs","role":"CSharpBinding"}],"root":{"declaredStructSize":64,"fields":[{"c":"uint32_t","csharp":"uint","name":"abi_version","offset":0,"rust":"u32","size":4},{"c":"uint32_t","csharp":"uint","name":"struct_size","offset":4,"rust":"u32","size":4},{"c":"uint64_t","csharp":"ulong","name":"capability_bits","offset":8,"rust":"u64","size":8}],"minimumStructSize":32,"tables":[{"name":"lumio_core_api","offset":16},{"name":"lumio_voxel_api","offset":24}]},"schemaEpoch":1,"tables":[{"declaredStructSize":48,"fields":[{"c":"uint32_t","csharp":"uint","name":"version","offset":0,"rust":"u32","size":4},{"c":"uint32_t","csharp":"uint","name":"struct_size","offset":4,"rust":"u32","size":4},{"c":"uint64_t","csharp":"ulong","name":"reserved0","offset":8,"rust":"u64","size":8}],"functionCount":3,"minimumStructSize":48,"name":"lumio_core_api","reservedSlots":1,"slots":[{"cSignature":"lumio_status_t (*lumio_core_init)(const struct lumio_core_config_v1* config, lumio_handle_t out_context)","csharpSignature":"LumioStatus lumio_core_init(IntPtr config, LumioHandle out_context)","name":"lumio_core_init","offset":16,"params":[{"name":"config","typeRef":"struct:core_config:v1"},{"name":"out_context","typeRef":"handle:core_context"}],"returns":"status","rustSignature":"extern \"C\" fn(config: *const LumioCoreConfigV1, out_context: LumioHandle) -> LumioStatus","slotIndex":0},{"cSignature":"lumio_status_t (*lumio_core_shutdown)(lumio_handle_t context)","csharpSignature":"LumioStatus lumio_core_shutdown(LumioHandle context)","name":"lumio_core_shutdown","offset":24,"params":[{"name":"context","typeRef":"handle:core_context"}],"returns":"status","rustSignature":"extern \"C\" fn(context: LumioHandle) -> LumioStatus","slotIndex":1},{"cSignature":"lumio_status_t (*lumio_core_last_error_detail)(lumio_handle_t context, lumio_buffer_t out_detail)","csharpSignature":"LumioStatus lumio_core_last_error_detail(LumioHandle context, LumioBuffer out_detail)","name":"lumio_core_last_error_detail","offset":32,"params":[{"name":"context","typeRef":"handle:core_context"},{"name":"out_detail","typeRef":"buffer:out"}],"returns":"status","rustSignature":"extern \"C\" fn(context: LumioHandle, out_detail: LumioBuffer) -> LumioStatus","slotIndex":2}],"version":1},{"declaredStructSize":32,"fields":[{"c":"uint32_t","csharp":"uint","name":"version","offset":0,"rust":"u32","size":4},{"c":"uint32_t","csharp":"uint","name":"struct_size","offset":4,"rust":"u32","size":4},{"c":"uint64_t","csharp":"ulong","name":"reserved0","offset":8,"rust":"u64","size":8}],"functionCount":2,"minimumStructSize":32,"name":"lumio_voxel_api","reservedSlots":0,"slots":[{"cSignature":"lumio_status_t (*lumio_voxel_world_create)(lumio_handle_t context, const struct lumio_voxel_world_desc_v1* desc, lumio_handle_t out_world)","csharpSignature":"LumioStatus lumio_voxel_world_create(LumioHandle context, IntPtr desc, LumioHandle out_world)","name":"lumio_voxel_world_create","offset":16,"params":[{"name":"context","typeRef":"handle:core_context"},{"name":"desc","typeRef":"struct:voxel_world_desc:v1"},{"name":"out_world","typeRef":"handle:voxel_world"}],"returns":"status","rustSignature":"extern \"C\" fn(context: LumioHandle, desc: *const LumioVoxelWorldDescV1, out_world: LumioHandle) -> LumioStatus","slotIndex":0},{"cSignature":"lumio_status_t (*lumio_voxel_world_destroy)(lumio_handle_t world)","csharpSignature":"LumioStatus lumio_voxel_world_destroy(LumioHandle world)","name":"lumio_voxel_world_destroy","offset":24,"params":[{"name":"world","typeRef":"handle:voxel_world"}],"returns":"status","rustSignature":"extern \"C\" fn(world: LumioHandle) -> LumioStatus","slotIndex":1}],"version":1}],"typeMapping":[{"align":1,"c":"uint8_t","csharp":"byte","rust":"u8","size":1,"typeRef":"u8"},{"align":2,"c":"uint16_t","csharp":"ushort","rust":"u16","size":2,"typeRef":"u16"},{"align":4,"c":"uint32_t","csharp":"uint","rust":"u32","size":4,"typeRef":"u32"},{"align":8,"c":"uint64_t","csharp":"ulong","rust":"u64","size":8,"typeRef":"u64"},{"align":1,"c":"int8_t","csharp":"sbyte","rust":"i8","size":1,"typeRef":"i8"},{"align":2,"c":"int16_t","csharp":"short","rust":"i16","size":2,"typeRef":"i16"},{"align":4,"c":"int32_t","csharp":"int","rust":"i32","size":4,"typeRef":"i32"},{"align":8,"c":"int64_t","csharp":"long","rust":"i64","size":8,"typeRef":"i64"},{"align":4,"c":"float","csharp":"float","rust":"f32","size":4,"typeRef":"f32"},{"align":8,"c":"double","csharp":"double","rust":"f64","size":8,"typeRef":"f64"},{"align":4,"c":"uint32_t","csharp":"uint","rust":"u32","size":4,"typeRef":"bool32"},{"align":4,"c":"lumio_status_t","csharp":"LumioStatus","rust":"LumioStatus","size":4,"typeRef":"status"},{"align":8,"c":"lumio_handle_t","csharp":"LumioHandle","rust":"LumioHandle","size":16,"typeRef":"handle:<kind>"},{"align":8,"c":"lumio_buffer_t","csharp":"LumioBuffer","rust":"LumioBuffer","size":24,"typeRef":"buffer:in"},{"align":8,"c":"lumio_buffer_t","csharp":"LumioBuffer","rust":"LumioBuffer","size":24,"typeRef":"buffer:out"},{"align":8,"c":"lumio_buffer_t","csharp":"LumioBuffer","rust":"LumioBuffer","size":24,"typeRef":"buffer:inout"},{"align":8,"c":"const lumio_<name>_v<N>*","csharp":"IntPtr","rust":"*const Lumio<Name>V<N>","size":8,"typeRef":"struct:<name>:v<N>"},{"align":8,"c":"const lumio_<name>*","csharp":"IntPtr","rust":"*const Lumio<Name>","size":8,"typeRef":"ptr:const:<name>"},{"align":8,"c":"lumio_<name>*","csharp":"IntPtr","rust":"*mut Lumio<Name>","size":8,"typeRef":"ptr:mut:<name>"}]}
